{
  "key": "example_value",
  "name": "Example Name",
  "description": "Example description",
  "variants": [
    {
      "key": "example_value",
      "name": "Example Name",
      "payload": "example_value",
      "description": "Example description",
      "rolloutWeight": 960
    }
  ],
  "bucketingKey": "example_value"
}